{
  "meta": {
    "title": "AlphaSignal corpus analysis",
    "source": "AlphaSignal newsletter",
    "analysis_date": "2026-09-21",
    "coverage_start": "2026-04-14",
    "coverage_end": "2026-09-21",
    "email_count": 130,
    "substantive_email_count": 129,
    "raw_signal_records": 912,
    "unique_catalog_records": 899,
    "sponsored_records": 65,
    "trend_count": 15,
    "project_count": 20,
    "publication_boundary": "Derivative analysis only. No email addresses, mailbox links, message identifiers, private headers, or full newsletter text are included."
  },
  "layers": [
    {
      "name": "Models & capabilities",
      "catalog_records": 217,
      "definition": "Foundation models, specialized models, multimodal capabilities, and local inference."
    },
    {
      "name": "Harness & orchestration",
      "catalog_records": 300,
      "definition": "Agent loops, state, memory, routing, sandboxes, and execution control."
    },
    {
      "name": "Tools, skills & integrations",
      "catalog_records": 188,
      "definition": "Reusable capabilities, data access, application connectors, and workflow components."
    },
    {
      "name": "Assurance layer",
      "catalog_records": 194,
      "definition": "Evaluation, validation, security, governance, and observability."
    }
  ],
  "findings": [
    {
      "finding": "Deployability is the dominant model story",
      "evidence": "Open weights, mixture-of-experts architectures, quantization, local inference, and routing appeared in 270 matched records."
    },
    {
      "finding": "Agents are becoming systems rather than chat interfaces",
      "evidence": "Durable state, parallel work, sandboxes, handoffs, skills, and model-independent harnesses form a distinct control layer."
    },
    {
      "finding": "Reliability is becoming the constraint",
      "evidence": "Validation, evaluation, observability, context management, and security recur alongside the largest applied categories."
    },
    {
      "finding": "Enabling layers offer the nearest-term leverage",
      "evidence": "Document routing, structured output, integrations, CLI wrappers, and durable agent state can upgrade many workflows at once."
    },
    {
      "finding": "The late-period mix shifts toward vertical deployment",
      "evidence": "September coverage increasingly combines domain indexes, live business-system access, governed data interfaces, and specialized agents."
    }
  ],
  "trends": [
    {
      "name": "Training, evaluation and self-improvement",
      "mentions": 149,
      "direction": "Broad rise through August",
      "finding": "More systems learned from failures, generated training environments, optimized prompts or exposed stronger evaluation methods.",
      "examples": [
        "WikiSkill",
        "PromptWizard",
        "Shopify pipeline"
      ],
      "primary_layer": "Assurance layer",
      "secondary_layer": "Models & capabilities",
      "cross_layer": true,
      "monthly_mentions": {
        "2026-04": 9,
        "2026-05": 14,
        "2026-06": 19,
        "2026-07": 19,
        "2026-08": 29,
        "2026-09": 23
      },
      "score": {
        "recurrence": 22,
        "acceleration": 20,
        "persistence": 25,
        "breadth": 22,
        "total": 89,
        "tier": "Structural"
      }
    },
    {
      "name": "Agent orchestration and autonomy",
      "mentions": 192,
      "direction": "Accelerating into Aug-Sep",
      "finding": "Agents moved from single-session assistants toward parallel, cloud-hosted and long-running work.",
      "examples": [
        "Claude Code Projects",
        "LoopX",
        "DeepSeek Harness"
      ],
      "primary_layer": "Harness & orchestration",
      "secondary_layer": "Tools, skills & integrations",
      "cross_layer": true,
      "monthly_mentions": {
        "2026-04": 17,
        "2026-05": 26,
        "2026-06": 34,
        "2026-07": 36,
        "2026-08": 44,
        "2026-09": 31
      },
      "score": {
        "recurrence": 23,
        "acceleration": 16,
        "persistence": 25,
        "breadth": 23,
        "total": 87,
        "tier": "Structural"
      }
    },
    {
      "name": "Open/local models and inference efficiency",
      "mentions": 273,
      "direction": "Dominant; peak in July",
      "finding": "Open weights, MoE, quantization, local and on-device inference repeatedly reduced cost and deployment constraints.",
      "examples": [
        "GLM",
        "Qwen",
        "DeepSeek",
        "Unsloth",
        "llama.cpp"
      ],
      "primary_layer": "Models & capabilities",
      "secondary_layer": null,
      "cross_layer": false,
      "monthly_mentions": {
        "2026-04": 26,
        "2026-05": 46,
        "2026-06": 40,
        "2026-07": 63,
        "2026-08": 39,
        "2026-09": 33
      },
      "score": {
        "recurrence": 25,
        "acceleration": 10,
        "persistence": 25,
        "breadth": 25,
        "total": 85,
        "tier": "Structural"
      }
    },
    {
      "name": "Validation and release bottlenecks",
      "mentions": 142,
      "direction": "Peak in July",
      "finding": "As agents generated more output, testing, review, observability and trustworthy deployment became the limiting layer.",
      "examples": [
        "runtime validation",
        "CI repair",
        "agent tracing"
      ],
      "primary_layer": "Assurance layer",
      "secondary_layer": "Harness & orchestration",
      "cross_layer": true,
      "monthly_mentions": {
        "2026-04": 10,
        "2026-05": 23,
        "2026-06": 23,
        "2026-07": 44,
        "2026-08": 31,
        "2026-09": 18
      },
      "score": {
        "recurrence": 22,
        "acceleration": 12,
        "persistence": 25,
        "breadth": 22,
        "total": 81,
        "tier": "Structural"
      }
    },
    {
      "name": "Coding agents and developer tooling",
      "mentions": 176,
      "direction": "Persistent; peak in June",
      "finding": "Coding remained the newsletter's largest applied domain, with growing emphasis on repo search, validation and release flow.",
      "examples": [
        "Codex",
        "Claude Code",
        "Cursor",
        "FastContext"
      ],
      "primary_layer": "Harness & orchestration",
      "secondary_layer": "Tools, skills & integrations",
      "cross_layer": true,
      "monthly_mentions": {
        "2026-04": 12,
        "2026-05": 15,
        "2026-06": 23,
        "2026-07": 15,
        "2026-08": 21,
        "2026-09": 11
      },
      "score": {
        "recurrence": 23,
        "acceleration": 12,
        "persistence": 25,
        "breadth": 20,
        "total": 80,
        "tier": "Structural"
      }
    },
    {
      "name": "Multimodal generation and 3D",
      "mentions": 99,
      "direction": "High and sustained",
      "finding": "Video, image, avatar and 3D systems became faster, more editable and increasingly local or real time.",
      "examples": [
        "depth-anything.cpp",
        "OpenReel",
        "avatar models"
      ],
      "primary_layer": "Models & capabilities",
      "secondary_layer": "Tools, skills & integrations",
      "cross_layer": true,
      "monthly_mentions": {
        "2026-04": 9,
        "2026-05": 14,
        "2026-06": 18,
        "2026-07": 22,
        "2026-08": 15,
        "2026-09": 17
      },
      "score": {
        "recurrence": 21,
        "acceleration": 13,
        "persistence": 25,
        "breadth": 21,
        "total": 80,
        "tier": "Structural"
      }
    },
    {
      "name": "Voice and audio interfaces",
      "mentions": 46,
      "direction": "Rising since July",
      "finding": "Low-latency speech, multilingual cloning and self-hosted voice-agent stacks turned voice into a practical workflow interface.",
      "examples": [
        "Dograh",
        "VoiceStudio",
        "realtime speech models"
      ],
      "primary_layer": "Models & capabilities",
      "secondary_layer": "Tools, skills & integrations",
      "cross_layer": true,
      "monthly_mentions": {
        "2026-04": 3,
        "2026-05": 5,
        "2026-06": 4,
        "2026-07": 13,
        "2026-08": 10,
        "2026-09": 8
      },
      "score": {
        "recurrence": 17,
        "acceleration": 17,
        "persistence": 25,
        "breadth": 17,
        "total": 76,
        "tier": "Strong"
      }
    },
    {
      "name": "Skills, plugins, MCP and harnesses",
      "mentions": 49,
      "direction": "Surged in July",
      "finding": "Reusable capabilities and interoperable tool layers became a distinct platform layer around models.",
      "examples": [
        "MCP",
        "Agent Skills",
        "DeepSeek Harness",
        "CLI-Anything"
      ],
      "primary_layer": "Tools, skills & integrations",
      "secondary_layer": "Harness & orchestration",
      "cross_layer": true,
      "monthly_mentions": {
        "2026-04": 3,
        "2026-05": 6,
        "2026-06": 6,
        "2026-07": 13,
        "2026-08": 10,
        "2026-09": 4
      },
      "score": {
        "recurrence": 17,
        "acceleration": 13,
        "persistence": 25,
        "breadth": 17,
        "total": 72,
        "tier": "Strong"
      }
    },
    {
      "name": "Security, safety and observability",
      "mentions": 38,
      "direction": "Sharp August spike",
      "finding": "Agent permissions, prompt injection, malicious skills, monitoring and red-teaming moved into the core stack.",
      "examples": [
        "agent tracing",
        "skill scanners",
        "OpenMed",
        "security CLIs"
      ],
      "primary_layer": "Assurance layer",
      "secondary_layer": "Harness & orchestration",
      "cross_layer": true,
      "monthly_mentions": {
        "2026-04": 1,
        "2026-05": 6,
        "2026-06": 3,
        "2026-07": 8,
        "2026-08": 9,
        "2026-09": 1
      },
      "score": {
        "recurrence": 16,